<?xml version = "1.0" encoding = "UTF-8"?>
<?xml-stylesheet type="text/xsl" href="resume.xsl"?>
<resume xmlns:xsi = "http://www.w3.org/2001/XMLSchema-instance" xsi:noNamespaceSchemaLocation = "resume.xsd">
	<title>Resume</title>
	<summary>
		<info>Over 10 years of professional experience in developing B2B and B2C Commerce web applications and Enterprise Application Integration.</info>
		<info>Consulting experience working with teams to scale and performance tune web applications with annual revenue in the Billions.</info>
		<info>Agile practitioner who has experience in Technical Training and Team leadership.</info>
	</summary>
	<personalInfo>
		<name>Tingu Ravi</name>
		<DOB>05-07-1979</DOB>
		<addressCommunication>
			<AddressLine>14926</AddressLine>
			<AddressLine>69 Ave</AddressLine>
			<AddressLine></AddressLine>
			<City>Surrey</City>
			<State>British Columbia</State>
			<Country>Canada</Country>
			<zip>V3S0Y8</zip>
		</addressCommunication>
		<addressPremanent>
			<AddressLine>14926</AddressLine>
			<AddressLine>69 Ave</AddressLine>
			<AddressLine></AddressLine>
			<City>Surrey</City>
			<State>British Columbia</State>
			<Country>Canada</Country>
			<zip>V3S0Y8</zip>
		</addressPremanent>
		<phone>604 442 0876</phone>
		<email>travi@xray4j.com</email>
		<citizenship>Canadian Permanent Resident,Indian</citizenship>
		<passportno>B0784312</passportno>
		<gender>Male</gender>
	</personalInfo>
	<education>
		<course>
			<name>Machine Learning</name>
			<startDate>2016</startDate>
			<endDate>2016</endDate>
			<grade>97 %</grade>
			<institution>
				<name>Stanford University - Coursea</name>
				<addressPremanent>
					<AddressLine>https://www.coursera.org/account/accomplishments/certificate/X22Z3WV3EWWX</AddressLine>
					<City>Coursea</City>
					<State>Coursea</State>
					<Country>Coursea</Country>
					<zip/>
				</addressPremanent>
			</institution>
		</course>
		<course>
			<name>Masters in Compuer Science</name>
			<startDate>2001</startDate>
			<endDate>2003</endDate>
			<grade>9.1 CGPA</grade>
			<institution>
				<name>Vellore Institute of Technology</name>
				<addressPremanent>
					<AddressLine>VIT</AddressLine>
					<City>Vellore</City>
					<State>Tamil Nadu</State>
					<Country>India</Country>
					<zip/>
				</addressPremanent>
			</institution>
		</course>
		<course>
			<name>Bachelor Of Computer Application </name>
			<startDate>1998</startDate>
			<endDate>2000</endDate>
			<grade>69%</grade>
			<institution>
				<name>Mahathma Gandhi University</name>
				<addressPremanent>
					<AddressLine>Kottayam</AddressLine>
					<City/>
					<State>Kerala</State>
					<Country>India</Country>
					<zip/>
				</addressPremanent>
			</institution>
		</course>
	</education>
	<workExperience>
		<experience>
		  <designation>Architect</designation>
		  <company>
		    <name>www.xray4j.com</name>
		    <addressPremanent>
		      <AddressLine>10180 153st</AddressLine>
		      <City>Surrey</City>
		      <State>British Columbia</State>
		      <Country>Canada</Country>
		      <zip>V3R 0B5</zip>
		    </addressPremanent>
		  </company>
		  <startDate>16 Aug 2017</startDate>
		  <endDate>Currently Working</endDate>
		  <project>
		    <name>www.xray4j.com</name>
		    <description>Xray4j is a startup that has developed a new way for documenting / troubleshooting/ performance tuning enterprise java applications like Oracle ATG Commerce, Hybris, Broadleaf Commerce.</description>
		    <startDate>Aug 2017</startDate>
		    <endDate>Currently Working</endDate>
				<client>Xray4j</client>
		    <URL>https://www.xray4j.com</URL>
		    <responsibilities>Design the over all architecture for xray4j.</responsibilities>
		    <responsibilities>Implement the java agent and  aspects used to collect data from the JVM and save them to a file.</responsibilities>
		    <responsibilities>Help implement the UI using angularjs.</responsibilities>
				<responsibilities>Create AspectJ instrumentation configuration for ATG Commerce, Hybris, Broadleaf Commerce.</responsibilities>
				<responsibilities>Gain enough exptertise with Vaadin8 to instrument web applications using Vaadin with aspects.</responsibilities>
		    <responsibilities>Design algorithms that represent the collected data from the JVM as easily understandable connected graphs.</responsibilities>
		    <responsibilities>Implement code that displays the most expensive paths for the control flow within a JVM.</responsibilities>
		    <technology>
		      <name>JHipster</name>
		      <proficiency/>
		    </technology>
		    <technology>
		      <name>AngularJs</name>
		      <proficiency/>
		    </technology>
		    <technology>
		      <name>AspectJ</name>
		      <proficiency/>
		    </technology>
		    <technology>
		      <name>AWS EC2</name>
		      <proficiency/>
		    </technology>
				<technology>
					<name>Vaadin8</name>
					<proficiency/>
				</technology>
		    <technology>
		      <name>AWS S3</name>
		      <proficiency/>
		    </technology>
		  </project>
		</experience>
		<experience>
		  <designation>Senior Technology Consultant</designation>
		  <company>
		    <name>SAP Canada</name>
		    <addressPremanent>
		      <AddressLine>910 Mainland St</AddressLine>
		      <City>Vancouver</City>
		      <State>British Columbia</State>
		      <Country>Canada</Country>
		      <zip>V6B 1A9</zip>
		    </addressPremanent>
		  </company>
		  <startDate>12 Jan 2017</startDate>
		  <endDate>15 Aug 2017</endDate>
		  <project>
		    <name>Levi Strauss &amp; Co</name>
		    <description>Played the role of senior developer in the project that was implemented end to end by SAP Hybris.</description>
		    <startDate>March 2017</startDate>
		    <endDate>Aug 2017</endDate>
				<client>Levi</client>
		    <URL>https://www.levi.com/CA/en_CA/</URL>
				<responsibilities>Developed tool to help team debug issues by browsing through beans in the spring context.</responsibilities>
				<responsibilities>Work on integration with Responsys for sending emails.</responsibilities>
		    <responsibilities>Work on the promotion module.</responsibilities>
		    <technology>
		      <name>SAP Hybris</name>
		      <proficiency/>
		    </technology>
		    <technology>
		      <name>Git</name>
		      <proficiency/>
		    </technology>
		  </project>
		</experience>
		<experience>
			<designation>Software Architect</designation>
			<company>
				<name>Rigabyte Inc</name>
				<addressPremanent>
					<AddressLine>10180 153st</AddressLine>
					<City>Surrey</City>
					<State>British Columbia</State>
					<Country>Canada</Country>
					<zip>V3R 0B5</zip>
				</addressPremanent>
			</company>
			<startDate>07 2014</startDate>
			<endDate>11 2016</endDate>
			<project>
				<name>Rigabyte</name>
				<description>Help design and architect a cloud based log management service from the ground up.</description>
				<startDate>Jul 2014</startDate>
				<endDate>Oct 2016</endDate>
				<client>Rigabyte Inc</client>
				<URL>http://www.rigabyte.com</URL>
				<responsibilities>Design the architecture for a high volume log management service.</responsibilities>
				<responsibilities>Set up the production environment on Amazon EC2</responsibilities>
				<responsibilities>Customize Apache Lucene to support high volume of log data processing.</responsibilities>
				<responsibilities>Design and implement agents that collect and deliver data to a cloud service.</responsibilities>
				<responsibilities>Design framework for automated UI tests, integration tests and performance tests.</responsibilities>
				<responsibilities>Implement RESTful webservices required by the application.</responsibilities>
				<responsibilities>Architect the noSQL persistance layer used by the application.</responsibilities>
				<technology>
					<name>Apache Lucene</name>
					<proficiency/>
				</technology>
				<technology>
					<name>Amazon AWS</name>
					<proficiency/>
				</technology>
				<technology>
					<name>Memcached</name>
					<proficiency/>
				</technology>
				<technology>
					<name>JQuery</name>
					<proficiency/>
				</technology>
				<technology>
					<name>Selenium</name>
					<proficiency/>
				</technology>
			</project>
		</experience>
	<experience>
			<designation>Senior Principal Consultant</designation>
			<company>
				<name>Oracle Canada</name>
				<addressPremanent>
					<AddressLine>505 Burrard Street</AddressLine>
					<City>Vancouver</City>
					<State>British Columbia</State>
					<Country>Canada</Country>
					<zip>V7X 1M5</zip>
				</addressPremanent>
			</company>
			<startDate>12 2011</startDate>
			<endDate>07 2014</endDate>
			<project>
				<name>Exito</name>
				<description>Help Exito fix problems with their production architecture for exito.com and ensure exito is able scale to  their fast growing internet traffic.</description>
				<startDate>Jan 2011</startDate>
				<endDate>Jul 2014</endDate>
				<client>Almacenes Ã‰xito S.A</client>
				<URL>http://exito.com</URL>
				<responsibilities>Help migration exito.com from ATG 9.4 to ATG 10.2 and Endeca.</responsibilities>
				<responsibilities>Setup new production / QA environment for the migrated application.</responsibilities>
				<responsibilities>Helped stabilize exito.com after a period of poor stability during the 2011 holiday season(Oct -Dec).</responsibilities>
				<responsibilities>Make architectural changes to exito.com to help with long term scalability. </responsibilities>
				<responsibilities>Help guide a team of 3 developers to implement a number of important change requests for exito.com</responsibilities>
				<responsibilities>Assist Exito do develop inhouse development capability and infrastructure without depending on their existing SI.</responsibilities>